{
  "schema_version": 1,
  "pipeline_version": "v6",
  "run_id": "daily-2025-11-30-20251130030536.-f20173b7",
  "generated_at": "2025-11-30T03:05:36.600Z",
  "source": "github",
  "stats": {
    "total": 6
  },
  "items": [
    {
      "canonical_id": "github:freeCodeCamp/freeCodeCamp",
      "origin_ids": [
        "freeCodeCamp/freeCodeCamp"
      ],
      "source": "github",
      "name": "freeCodeCamp",
      "url": "https://github.com/freeCodeCamp/freeCodeCamp",
      "description": "freeCodeCamp.org's open-source codebase and curriculum. Learn math, programming, and computer science for free.",
      "tags": [
        "careers",
        "certification",
        "community",
        "curriculum",
        "d3",
        "education",
        "freecodecamp",
        "javascript",
        "learn-to-code",
        "math",
        "nodejs",
        "nonprofits",
        "programming",
        "react",
        "teachers"
      ],
      "summary_short": {
        "zh": "freeCodeCamp.org's open-source codebase and curriculum. Learn math, programming, and computer science for free.",
        "en": "freeCodeCamp.org's open-source codebase and curriculum. Learn math, programming, and computer science for free.",
        "es": ""
      },
      "summary_flags": {
        "needs_tri": true,
        "fast_first": true,
        "placeholder": true
      },
      "summary_version": 0,
      "status": "pending",
      "promptHash": "sha256:7ce99892d88148e7d5cae0b4fc07936e1c16cb26ec455fb4ce856749a954c941",
      "stats": {
        "stars": 433655,
        "forks": 42635,
        "issues": 309
      },
      "metadata": {
        "license": "BSD-3-Clause",
        "lang": "TypeScript",
        "categories": {
          "capabilities": [],
          "scenes": [],
          "lifecycle": []
        }
      },
      "created_at": "2025-11-30T03:05:36.600Z",
      "updated_at": "2025-11-30T03:05:36.600Z",
      "owner": "freeCodeCamp"
    },
    {
      "canonical_id": "github:sindresorhus/awesome",
      "origin_ids": [
        "sindresorhus/awesome"
      ],
      "source": "github",
      "name": "awesome",
      "url": "https://github.com/sindresorhus/awesome",
      "description": "😎 Awesome lists about all kinds of interesting topics",
      "tags": [
        "awesome",
        "awesome-list",
        "lists",
        "resources",
        "unicorns"
      ],
      "summary_short": {
        "zh": "😎 Awesome lists about all kinds of interesting topics",
        "en": "😎 Awesome lists about all kinds of interesting topics",
        "es": ""
      },
      "summary_flags": {
        "needs_tri": true,
        "fast_first": true,
        "placeholder": true
      },
      "summary_version": 0,
      "status": "pending",
      "promptHash": "sha256:2724fb8aae725474927df4f6b45de69bae28d10fbcf1a45f9da35c228ebe25de",
      "stats": {
        "stars": 418934,
        "forks": 32458,
        "issues": 52
      },
      "metadata": {
        "license": "CC0-1.0",
        "lang": "N/A",
        "categories": {
          "capabilities": [],
          "scenes": [],
          "lifecycle": []
        }
      },
      "created_at": "2025-11-30T03:05:36.600Z",
      "updated_at": "2025-11-30T03:05:36.600Z",
      "owner": "sindresorhus"
    },
    {
      "canonical_id": "github:public-apis/public-apis",
      "origin_ids": [
        "public-apis/public-apis"
      ],
      "source": "github",
      "name": "public-apis",
      "url": "https://github.com/public-apis/public-apis",
      "description": "A collective list of free APIs",
      "tags": [
        "api",
        "apis",
        "dataset",
        "development",
        "free",
        "list",
        "lists",
        "open-source",
        "public",
        "public-api",
        "public-apis",
        "resources",
        "software"
      ],
      "summary_short": {
        "zh": "A collective list of free APIs",
        "en": "A collective list of free APIs",
        "es": ""
      },
      "summary_flags": {
        "needs_tri": true,
        "fast_first": true,
        "placeholder": true
      },
      "summary_version": 0,
      "status": "pending",
      "promptHash": "sha256:2f7e803145c8932a8d3a6af2351a8c66d6db19e0b3d661aba966423d3b32968f",
      "stats": {
        "stars": 381863,
        "forks": 40680,
        "issues": 734
      },
      "metadata": {
        "license": "MIT",
        "lang": "Python",
        "categories": {
          "capabilities": [],
          "scenes": [],
          "lifecycle": []
        }
      },
      "created_at": "2025-11-30T03:05:36.600Z",
      "updated_at": "2025-11-30T03:05:36.600Z",
      "owner": "public-apis"
    },
    {
      "canonical_id": "github:EbookFoundation/free-programming-books",
      "origin_ids": [
        "EbookFoundation/free-programming-books"
      ],
      "source": "github",
      "name": "free-programming-books",
      "url": "https://github.com/EbookFoundation/free-programming-books",
      "description": ":books: Freely available programming books",
      "tags": [
        "books",
        "education",
        "hacktoberfest",
        "list",
        "resource"
      ],
      "summary_short": {
        "zh": ":books: Freely available programming books",
        "en": ":books: Freely available programming books",
        "es": ""
      },
      "summary_flags": {
        "needs_tri": true,
        "fast_first": true,
        "placeholder": true
      },
      "summary_version": 0,
      "status": "pending",
      "promptHash": "sha256:f498b06b6c0acc167c4862603584f4df565b0c479f8ee125ddcb7f6ddcef5d05",
      "stats": {
        "stars": 377966,
        "forks": 65576,
        "issues": 201
      },
      "metadata": {
        "license": "CC-BY-4.0",
        "lang": "Python",
        "categories": {
          "capabilities": [],
          "scenes": [],
          "lifecycle": []
        }
      },
      "created_at": "2025-11-30T03:05:36.600Z",
      "updated_at": "2025-11-30T03:05:36.600Z",
      "owner": "EbookFoundation"
    },
    {
      "canonical_id": "github:jwasham/coding-interview-university",
      "origin_ids": [
        "jwasham/coding-interview-university"
      ],
      "source": "github",
      "name": "coding-interview-university",
      "url": "https://github.com/jwasham/coding-interview-university",
      "description": "A complete computer science study plan to become a software engineer.",
      "tags": [
        "algorithm",
        "algorithms",
        "coding-interview",
        "coding-interviews",
        "computer-science",
        "data-structures",
        "interview",
        "interview-prep",
        "interview-preparation",
        "programming-interviews",
        "software-engineering",
        "study-plan"
      ],
      "summary_short": {
        "zh": "A complete computer science study plan to become a software engineer.",
        "en": "A complete computer science study plan to become a software engineer.",
        "es": ""
      },
      "summary_flags": {
        "needs_tri": true,
        "fast_first": true,
        "placeholder": true
      },
      "summary_version": 0,
      "status": "pending",
      "promptHash": "sha256:3c6ec9fbea8a96a623f2f38d74b2bd6b437e27ea550dfe100cfa566625f218a3",
      "stats": {
        "stars": 334265,
        "forks": 81374,
        "issues": 89
      },
      "metadata": {
        "license": "CC-BY-SA-4.0",
        "lang": "N/A",
        "categories": {
          "capabilities": [],
          "scenes": [],
          "lifecycle": []
        }
      },
      "created_at": "2025-11-30T03:05:36.600Z",
      "updated_at": "2025-11-30T03:05:36.600Z",
      "owner": "jwasham"
    },
    {
      "canonical_id": "github:rasbt/LLMs-from-scratch",
      "origin_ids": [
        "rasbt/LLMs-from-scratch"
      ],
      "source": "github",
      "name": "LLMs-from-scratch",
      "url": "https://github.com/rasbt/LLMs-from-scratch",
      "description": "Implement a ChatGPT-like LLM in PyTorch from scratch, step by step",
      "tags": [
        "ai",
        "artificial-intelligence",
        "chatbot",
        "chatgpt",
        "deep-learning",
        "from-scratch",
        "generative-ai",
        "gpt",
        "language-model",
        "large-language-models",
        "llm",
        "machine-learning",
        "neural-networks",
        "python",
        "pytorch",
        "transformers"
      ],
      "summary_short": {
        "zh": "Implement a ChatGPT-like LLM in PyTorch from scratch, step by step",
        "en": "Implement a ChatGPT-like LLM in PyTorch from scratch, step by step",
        "es": ""
      },
      "summary_flags": {
        "needs_tri": true,
        "fast_first": true,
        "placeholder": true
      },
      "summary_version": 0,
      "status": "pending",
      "promptHash": "sha256:d9d7a197c060b1217a86f06a2f04cd91b1571185c40f7e40c8b4b93d41985ceb",
      "stats": {
        "stars": 80108,
        "forks": 11926,
        "issues": 1
      },
      "metadata": {
        "license": "N/A",
        "lang": "Jupyter Notebook",
        "categories": {
          "capabilities": [],
          "scenes": [],
          "lifecycle": []
        }
      },
      "created_at": "2025-11-30T03:05:36.600Z",
      "updated_at": "2025-11-30T03:05:36.600Z",
      "owner": "rasbt"
    }
  ]
}
